{
  "repo": "D:\\Projects\\Python\\AetherTrade\\AetherTrade",
  "state_dir": "D:\\Projects\\Python\\AetherTrade\\TradingHandoff\\AutoDispatch\\.runtime",
  "worktree_root": "D:\\Projects\\Python\\AetherTrade\\TradingHandoff\\AutoDispatchWorktrees",
  "remote_url": "https://github.com/Wuysau/AetherTrade.git",
  "environment": "OFFLINE_DEVELOPMENT",
  "live_authorized": false,
  "opencode_environment": "windows",
  "codex_command": [
    "D:/CodingTools/node-v24.13.0-win-x64/node.exe",
    "D:/CodingTools/node-v24.13.0-win-x64/node_global/node_modules/@openai/codex/bin/codex.js"
  ],
  "opencode_command": [
    "D:/CodingTools/node-v24.13.0-win-x64/node_global/node_modules/@opencode/cli/bin/opencode.exe"
  ],
  "npm_command": [
    "D:/CodingTools/node-v24.13.0-win-x64/node.exe",
    "D:/CodingTools/node-v24.13.0-win-x64/node_modules/npm/bin/npm-cli.js"
  ],
  "task_timeout_seconds": 3600,
  "command_timeout_seconds": 600,
  "max_agent_requests": 12,
  "max_tasks": 2,
  "max_workers": "auto",
  "manifest_sha256": "ce3f17a96135761eb1c33a6f6d104840c213beb0711502c7a49f86ceb4cede28",
  "pins": {
    "docs/superpowers/plans/ai-trading/task-graph.json": "9a15031d6d8fafa754fad58a698328dbcc2b59be5aad508b4d49d000ed053d8c",
    "docs/spec/APPROVAL.md": "a3b0a4123529b9dc9965a4b3622bc24b1f9925fe52d89e0a6cf9da8c666a9e12",
    "docs/superpowers/plans/ai-trading/INTERFACE_CATALOG.md": "421e5f493b11395c2120e45d95eb130a0d35130d6d11f4962b42d90caf59d011",
    "docs/superpowers/plans/ai-trading/tasks/IP-00.md": "c63e6ff425e580a9fe6b3e64f9212f500ef6e677372dfbb1260d86bac9328848",
    "docs/superpowers/plans/ai-trading/tasks/IP-01.md": "8321a4f068eb32237672bdd1603097974949e4acd381dc1bdc4da3c5713d1f0e",
    "docs/superpowers/plans/ai-trading/tasks/IP-02.md": "558f7307734dc65d4540a636e0f59cb28db4c6ac9a31d0d1c7b6a39aaa837342",
    "docs/superpowers/plans/ai-trading/tasks/IP-03.md": "d2d93a6180ca7b719e8f2e671a22c0afa50829b2d8d08b9e0ae44e8f7786c501",
    "docs/superpowers/plans/ai-trading/tasks/IP-04.md": "5e224c0c797b5649f19a54c43dd0f0a347d6fa44397a989f92117c9a6979406a",
    "docs/superpowers/plans/ai-trading/tasks/IP-05.md": "f7b03106d81e83d2f464759d24092363c5f6a261a8f8bd71dd9311772734d629",
    "docs/superpowers/plans/ai-trading/tasks/IP-06.md": "9b5c46ca7a8c09b637b89f0dca650cc204d7c4495c2f7e4462063d0492fd5347",
    "docs/superpowers/plans/ai-trading/tasks/IP-07.md": "4adc5136cb357da9e741fff8e0cb819bf40efc5b22d7b17098f0b293d7d38f43",
    "docs/superpowers/plans/ai-trading/tasks/IP-08.md": "16080cda13ca22951051f3708661c30a6fae1884f55c9d6650d6f6c3bb086864",
    "docs/superpowers/plans/ai-trading/tasks/IP-09.md": "4916719b24293faa53f306970c829eb5f14d944263f81c3eec7a9cfc4935d3a2",
    "docs/superpowers/plans/ai-trading/tasks/IP-10.md": "de4df078f8ca4571ec2e7177bfdc5e900470899734fa0ff116e9db37e768cf27",
    "docs/superpowers/plans/ai-trading/tasks/IP-11.md": "bcf8c1640fc9346a0bba19bca0dfe2fec387472aa3c9e6564f0dd2e506fb30bc",
    "docs/superpowers/plans/ai-trading/tasks/IP-12.md": "6725d0a809fadb31fa63af09286d55e640431b56b0b6c367a08ea4856d5681ab",
    "docs/superpowers/plans/ai-trading/tasks/IP-13.md": "c73a2ae523c1dbade8bfa6fd0da8c6174dac152cf9878a4d64683fcb4cefa482",
    "docs/superpowers/plans/ai-trading/tasks/IP-14.md": "fc95141e4ec3b8012ad4da2298c94a36a6db23838b01a958a6f43a9f16fcef5d",
    "docs/superpowers/plans/ai-trading/tasks/IP-15.md": "7d4520cbe07f53572cdc57c997d146e75bc8de8e827628877d41253de15f0572",
    "docs/superpowers/plans/ai-trading/tasks/IP-16.md": "32a7f54bb1f302958dac8990d027e72e9d309d1d223c433f06f528d3e67a06cc",
    "docs/superpowers/plans/ai-trading/tasks/IP-17.md": "4092e8329f3dd26cec4924116d96ab406d5db21a4ce2d1d3c9565b6c2885c596",
    "docs/superpowers/plans/ai-trading/tasks/IP-18.md": "181915fb865effdf869c5b7f9d4189e9bf52e31e90ebae70f0b5198986597685",
    "docs/superpowers/plans/ai-trading/tasks/IP-19.md": "9d40157498946644444586508e2d08f175108fd8bc57c2d426591418aad7bc9c",
    "docs/superpowers/plans/ai-trading/tasks/IP-20.md": "317d3b867aaf6857c7b25a268dd82779cd5b0efca099a1d869b50385341ffb70",
    "docs/superpowers/plans/ai-trading/tasks/IP-21.md": "c41672d16885c1c3b72a4b28bd88c2e4e77d1e29110f5b457dbdd5ebd5ced20b",
    "docs/superpowers/plans/ai-trading/tasks/IP-22.md": "9fd1e013f44b40d4de113e43edc2afc329ba739d449b036b8290ddd68f026316",
    "docs/superpowers/plans/ai-trading/tasks/IP-23.md": "d8a79abc7eec5d5b5709b71f042a03045304c79d4cc1ead25734780bba6f07ea",
    "docs/superpowers/plans/ai-trading/tasks/IP-24.md": "09b6e4dbf0572cd053d5f18e6e4c494acb24ab737cc558dec82a92f4ad45e3e1",
    "docs/superpowers/plans/ai-trading/tasks/IP-25.md": "44919e6b58582b23bdef7e43e16d98e9df09b7f6d021ad51ffd784242c9b0b27",
    "docs/superpowers/plans/ai-trading/tasks/IP-26.md": "0e3664f9f81d6c7a62a3380fc7350dd5c35170fef171e1e6808369691dcb67c1",
    "docs/superpowers/plans/ai-trading/tasks/IP-27.md": "94b51220649faad8780313a73988f8904f1d927fde41dd21e1baae8e27c869d5",
    "docs/superpowers/plans/ai-trading/tasks/IP-28.md": "540bc55501b4ca8f0fb0946b17a42af770fc2c52f9985cc2ad5a7ed74b81b757",
    "docs/superpowers/plans/ai-trading/tasks/IP-29.md": "e02f86a718277bb28398975bfd68deeb2589bbfaf393b5145f4b0a3d9d8fd372",
    "docs/superpowers/plans/ai-trading/tasks/IP-30.md": "e0bea41fdea512798f2bbea453f7bf49832a8c37293eee074fd6cc5820643821",
    "docs/superpowers/plans/ai-trading/tasks/IP-31.md": "530133de93acfa9398297d3e90317944ca732ac723a587295a9cec73a60f9795",
    "docs/superpowers/plans/ai-trading/tasks/IP-32.md": "ef5fef9ec4455f25b435e3fc673c2cb92a600f77b30a7c1fae9ef3e5ac3f3834",
    "docs/superpowers/plans/ai-trading/tasks/IP-33.md": "a711d838114a1537bfa2b11abf4be7428a7876fcc14a2e09fd9b97d15a5b5975",
    "docs/superpowers/plans/ai-trading/tasks/IP-34.md": "1f25eda3ecbf9165fe610bd1e53dc0bdbb8106b202a859fbb3e07899e7e9d497",
    "docs/superpowers/plans/ai-trading/tasks/IP-35.md": "a647f7145092d3b9bd05e13bc5403418c89f9b31d6034f831eaefb7579cbd583",
    "docs/superpowers/plans/ai-trading/tasks/IP-36.md": "c06c687e330fa62eb11bf7755977437a3ec9c7e3dfa163bcea47c6571cba6950",
    "docs/superpowers/plans/ai-trading/tasks/IP-37.md": "e047b5d016c84b26e9220a6747d720038371c46f73850b4429788152bd531073",
    "docs/superpowers/plans/ai-trading/tasks/IP-38.md": "d447ae0c155baaaf2f93c2d0d003ed2bb9e91c31ae3eec1211462b704176b157",
    "prompts/tasks/IP-00-Codex.md": "5623f2ee95ec06ecb1974bb6c2a5355cf8c867206129e3feefbc155c47fd4152",
    "prompts/tasks/IP-01-Codex.md": "c31ac6646f0f31943f81c21044608925eba4a1e844d0998c313f3f311172ecd9",
    "prompts/tasks/IP-02-Codex.md": "e7a5c86fd6c3ae9c284b7c4e1dc984da00272301efa49cc62fcb6130e305d85a",
    "prompts/tasks/IP-03-Codex.md": "53e6565785edd9668c2b8796cd06cd54cefd347f6e5ff8803a0bd24e70389dff",
    "prompts/tasks/IP-04-Codex.md": "e6dfe18494eb56195492885b010c986db36c5651a9a079a95e9fefa0713a631a",
    "prompts/tasks/IP-05-OpenCode.md": "b1b14d6ca7a78f65bed2874f3593377635823c042c3af2ae014c71bed33969ca",
    "prompts/tasks/IP-06-Codex.md": "fca3130a5da5bfc5af8cad69af47f35a293380b0cff7515b15f77e8f916511b2",
    "prompts/tasks/IP-07-Codex.md": "645cb021d98cd29d172f657e5ec6370833f7814d438d26a32deb3d52bf326251",
    "prompts/tasks/IP-08-Codex.md": "669e3f02a1456fe7cb68446dc78a630b080ad698d049b90766f493dffaa3a373",
    "prompts/tasks/IP-09-Codex.md": "a64a5f59c8649d46f2af78b66565d439fad7a4281a1315a616dc7a4fbca16600",
    "prompts/tasks/IP-10-Codex.md": "6bad88aa8d7cb5910795667bc1762b4c745a49f0cdc7a60e1cdc99fac0dafb60",
    "prompts/tasks/IP-11-Codex.md": "eee9022bfd0baf585c6a00778b7a266f11cd38b0dda881ec1a1feca30baa6ffa",
    "prompts/tasks/IP-12-Codex.md": "32f8f2732e976dab9aea7e5cc46175fa250aabbdd7853a4b9677350ea18936bd",
    "prompts/tasks/IP-13-Codex.md": "cea7a72a87a90b2f8e5cf0f2d8ffaa03135b24917c6beb794218660891338c5d",
    "prompts/tasks/IP-14-Codex.md": "7062695739fd5dfc73a304e5c162b9a8e07b6b2400e95fb6146d952585191a4b",
    "prompts/tasks/IP-15-Codex.md": "2b74d7199e2043a6b74323f2a0baddb480e9b6318d124388062afe7a85e339de",
    "prompts/tasks/IP-16-Codex.md": "4b425454822deb3092ad295193e061ba52006410f1d3c3787826bc8dd23d42c8",
    "prompts/tasks/IP-17-Codex.md": "c08f5f0b17c5afef22b2dcbdcf09ac7c12289917577d0c05cfc19bdf4a054c20",
    "prompts/tasks/IP-18-Codex.md": "04f4d60d79e756e8f5d46e515eec58ca520059f04e31ea60ac1a7890af6a4735",
    "prompts/tasks/IP-19-Codex.md": "da7ccc2ff1a65349237c6f613f73c3cc01e1d73f0891f7b75e8ac3ad44f60f5b",
    "prompts/tasks/IP-20-OpenCode.md": "0533b377913c0fbb75d22d4037dbb735a96f2db598d452c66d321cffae90fd54",
    "prompts/tasks/IP-21-Codex.md": "d330733d8ab8663e73a741e8d8217d8a07328cdddfa8c2ced993b797d5b556e5",
    "prompts/tasks/IP-22-Codex.md": "c5150a56dc4614a3246662e6d9dc0f2f2ba25684cc48ae0824edd4ec270e87e2",
    "prompts/tasks/IP-23-Codex.md": "2f7b5458f81f0574b85ed282f1fad4b993b37f516decf450554e416d9553eda8",
    "prompts/tasks/IP-24-Codex.md": "9de05c31ca61bbdb5b786f75cbbe3b31d41222049a1f98a0e59b82c462555d79",
    "prompts/tasks/IP-25-Codex.md": "c20ac6f11684c467ca9be2b00186032fe696925de53fc84222487ce6a24a4f13",
    "prompts/tasks/IP-26-Codex.md": "a197ab2a6b8bbb1ff6647191a455704b7f69345ae98ef804c01e324cd450ecca",
    "prompts/tasks/IP-27-Codex.md": "afccd1042119210fc37c6a0f83dc6a67a63208efc2c605650ea553c8bd42a841",
    "prompts/tasks/IP-28-OpenCode.md": "3070afbad7761b6b95fdc6c0447091fdaecd1794abaa582831cb848c9ff3dd0e",
    "prompts/tasks/IP-29-OpenCode.md": "18a8e661ebed3aeceacc993b1d734f7a2013ae2140ace5a01863650ecaff4769",
    "prompts/tasks/IP-30-Codex.md": "9481d248430609eac597eac9f4532c7f9e0ddbd6157e810b7cba7f6fea6f1781",
    "prompts/tasks/IP-31-OpenCode.md": "1c6aaab44e3454aee7cadea67ab4b736894e1af9bc9c5d0de8161d39f221389a",
    "prompts/tasks/IP-32-Codex.md": "99e182628e90145b3b877fa3e0d3916c61b71ea2bafd75fe70d9ec0e5334b4b3",
    "prompts/tasks/IP-33-Codex.md": "ca9c415c65e104668f86177459dab36041722b0d30e80d9abd8a854d5b9e6e62",